{"action_count":4000,"assembly_sha256":"0861BFA1DF347538D932F22D580E75420F08082792EB914E53B4882764ACDBE9","cli_protocol_version":"0.2.0","created_at_utc":"2026-08-31T00:00:00Z","dataset_id":"global-prototype-act1-v0","estimated_count":4000,"feature_config_hash":"122e0e4401c32925cabcb488a30d255d0524f89b83f194938a172f46693f2a6e","feature_schema_version":"deck-feature-v1","game_branch":"beta","game_commit":"41cef1ea","game_version":"v0.111.0","generator_config_hash":"2045168bf85c18fcf305bb56fe3b67519f93a8b7d6d9d0480d1a9114aee54fec","label_source":"EstimatedByHeuristic","model_version":"global-prototype-v0","public_leakage_count":0,"quality_counts":{"EstimatedByHeuristic":4000},"reliable_count":0,"row_count":1000,"schema_version":"global-manifest-v1","semantic_catalog_version":"runtime-v0.111","simulator_version":"global-synthetic-v1","source_hashes":["ad3ec10e7b43b2b6df5680448169208389e72e514d9c65d6317434fd91afa098"],"split_policy":"scenario_id grouped; seed internal-only","stable_id_missing":0,"stage":"prototype","state_count":1000,"uncalculable_count":0}
